{
  "eventId": "evt_01HQAHEARTBEAT001",
  "taskId": "task_123",
  "sessionId": "sess_abc",
  "assistant": "gpt",
  "type": "HEARTBEAT",
  "timestamp": "2026-04-08T09:00:20Z",
  "seq": 4,
  "eventVersion": 1,
  "payload": {
    "nodeId": "node-local-1",
    "status": "alive",
    "uptimeMs": 120000
  }
}
