{
  "eventId": "evt_test_task_done_001",
  "taskId": "task_test_123",
  "sessionId": "sess_test_abc",
  "assistant": "test",
  "type": "TASK_DONE",
  "timestamp": "2026-04-08T10:12:00Z",
  "seq": 70,
  "eventVersion": 1,
  "payload": {
    "result": "coded_reviewed_tested",
    "status": "ok",
    "intent": "code_change",
    "planName": "code_change_pipeline",
    "steps": [
      "analyze intent",
      "apply patch",
      "run tests"
    ],
    "reviewApproved": true,
    "reviewSummary": "Review passed with low risk.",
    "testStatus": "ok",
    "testAttempts": 2,
    "testRetries": 1,
    "attempt": 1,
    "maxAttempts": 3,
    "traceId": "trc_task_test_123",
    "runId": "run_test_001"
  }
}
