{
  "eventId": "evt_01HQ9TOOLEND001",
  "taskId": "task_123",
  "sessionId": "sess_abc",
  "assistant": "gpt",
  "type": "TOOL_END",
  "timestamp": "2026-04-05T10:00:05Z",
  "seq": 31,
  "eventVersion": 1,
  "payload": {
    "tool": "command.exec",
    "status": "ok",
    "exitCode": 0,
    "output": "BUILD SUCCESS",
    "toolVersion": "1.0.0",
    "traceId": "trc_task_123",
    "runId": "run_01HQ9TOOL001"
  }
}
