{
  "eventId": "evt_test_nl2web_artifact_ready_001",
  "taskId": "task_test_123",
  "sessionId": "sess_test_abc",
  "assistant": "test",
  "type": "ARTIFACT_READY",
  "timestamp": "2026-04-09T09:08:00Z",
  "seq": 76,
  "eventVersion": 1,
  "payload": {
    "target": "web",
    "templateId": "web-basic",
    "exportMode": "zip",
    "artifact": {
      "artifactId": "art_export_zip_test_001",
      "fileName": "export.zip",
      "sha256": "sha256:1b2c3d4e5f60718293a4b5c6d7e8f901234567890abcdef1234567890abcdef",
      "size": 1048576,
      "mimeType": "application/zip",
      "type": "zip",
      "downloadUrl": "https://autocode.example.invalid/artifacts/art_export_zip_test_001",
      "entryPath": "index.html"
    },
    "kind": "zip"
  }
}

