{
  "eventId": "evt_test_approval_required_001",
  "taskId": "task_test_123",
  "sessionId": "sess_test_abc",
  "assistant": "test",
  "type": "APPROVAL_REQUIRED",
  "timestamp": "2026-04-05T10:00:00Z",
  "seq": 40,
  "eventVersion": 1,
  "payload": {
    "approvalId": "apr_test_001",
    "reason": "publish requires review",
    "context": {
      "action": "app.publish",
      "tool": "publish.run",
      "workspaceRef": "D:/workspace/test",
      "inputsHash": "sha256:13d1746e51afcf6962ec8f0fc70823ea89993f31708bcfb5f4f2467f7af450f9"
    }
  }
}
