{
  "eventId": "evt_test_heartbeat_001",
  "taskId": "task_test_123",
  "sessionId": "sess_test_abc",
  "assistant": "test",
  "type": "HEARTBEAT",
  "timestamp": "2026-04-08T09:00:20Z",
  "seq": 4,
  "eventVersion": 1,
  "payload": {
    "nodeId": "node-test-1",
    "status": "alive",
    "uptimeMs": 30000
  }
}
