{
  "eventId": "evt_test_deploy_plan_001",
  "taskId": "task_test_123",
  "sessionId": "sess_test_abc",
  "assistant": "test",
  "type": "DEPLOY_PLAN",
  "timestamp": "2026-04-04T08:00:00Z",
  "seq": 20,
  "eventVersion": 1,
  "payload": {
    "requestId": "deploy_req_test_001",
    "environment": "staging",
    "artifact": {
      "artifactId": "art_zip_test_001",
      "name": "export.zip",
      "hash": "sha256:1b2c3d4e5f60718293a4b5c6d7e8f901234567890abcdef1234567890abcdef",
      "size": 1048576,
      "mime": "application/zip",
      "type": "zip"
    },
    "context": {
      "action": "app.publish",
      "tool": "publish.run",
      "workspaceRef": "D:/workspace/test",
      "inputsHash": "sha256:13d1746e51afcf6962ec8f0fc70823ea89993f31708bcfb5f4f2467f7af450f9"
    }
  }
}
