{
  "eventId": "evt_01HQ8DEPLOYRESULT001",
  "taskId": "task_123",
  "sessionId": "sess_abc",
  "assistant": "gpt",
  "type": "DEPLOY_RESULT",
  "timestamp": "2026-04-04T08:03:00Z",
  "seq": 61,
  "eventVersion": 1,
  "payload": {
    "requestId": "deploy_req_001",
    "deploymentId": "dep_20260404_001",
    "environment": "staging",
    "status": "success",
    "message": "Deployment completed.",
    "endpointUrl": "https://autocode-demo.example.invalid",
    "startedAt": "2026-04-04T08:01:00Z",
    "finishedAt": "2026-04-04T08:02:45Z",
    "resultArtifact": {
      "artifactId": "art_deploy_report_001",
      "name": "deploy-report.json",
      "mime": "application/json",
      "type": "deploy_report"
    }
  }
}
