{
  "eventId": "evt_01HQ9APRRES001",
  "taskId": "task_123",
  "sessionId": "sess_abc",
  "assistant": "gpt",
  "type": "APPROVAL_RESULT",
  "timestamp": "2026-04-05T10:01:00Z",
  "seq": 41,
  "eventVersion": 1,
  "payload": {
    "approvalId": "apr_01HQ9APR001",
    "decision": "approve",
    "message": "approved by operator_001",
    "context": {
      "action": "app.publish",
      "tool": "publish.run",
      "workspaceRef": "D:/Develop/Project/AutoCode",
      "inputsHash": "sha256:13d1746e51afcf6962ec8f0fc70823ea89993f31708bcfb5f4f2467f7af450f9"
    }
  }
}
