{
  "eventId": "evt_01HQ9TASKDONE001",
  "taskId": "task_123",
  "sessionId": "sess_abc",
  "assistant": "gpt",
  "type": "TASK_DONE",
  "timestamp": "2026-04-08T10:12:00Z",
  "seq": 70,
  "eventVersion": 1,
  "payload": {
    "result": "success",
    "status": "ok",
    "tool": "command.exec",
    "toolVersion": "1.0.0",
    "exitCode": 0,
    "retryable": false,
    "output": "BUILD SUCCESS",
    "traceId": "trc_task_123",
    "runId": "run_01HQ9TASK001"
  }
}
