{
  "eventId": "evt_01HQ9TOOLSTART001",
  "taskId": "task_123",
  "sessionId": "sess_abc",
  "assistant": "gpt",
  "type": "TOOL_START",
  "timestamp": "2026-04-05T10:00:00Z",
  "seq": 30,
  "eventVersion": 1,
  "payload": {
    "tool": "command.exec",
    "action": "run_command",
    "command": "mvn -pl shared-protocol test",
    "cwd": "D:/Develop/Project/AutoCode",
    "toolVersion": "1.0.0",
    "approvalId": "apr_01HQ9APPROVAL001",
    "traceId": "trc_task_123",
    "runId": "run_01HQ9TOOL001"
  }
}
