{
  "eventId": "evt_01HQ7G0A9E9Y1K2V9B8H1M7J6Q",
  "taskId": "task_123",
  "sessionId": "sess_abc",
  "assistant": "gpt",
  "type": "ARTIFACT_READY",
  "timestamp": "2026-04-01T09:05:00Z",
  "seq": 42,
  "eventVersion": 1,
  "payload": {
    "artifact": {
      "artifactId": "art_export_zip_001",
      "name": "export.zip",
      "hash": "sha256:1b2c3d4e5f60718293a4b5c6d7e8f901234567890abcdef1234567890abcdef",
      "size": 1048576,
      "mime": "application/zip",
      "type": "zip",
      "entryPath": "dist/index.html",
      "build": {
        "command": "npm ci && npm run build",
        "workingDir": "."
      },
      "run": {
        "hints": ["Preview static export under dist/."]
      }
    },
    "kind": "zip"
  }
}
