{
  "eventId": "evt_test_001",
  "taskId": "task_test_123",
  "sessionId": "sess_test_abc",
  "assistant": "test",
  "type": "ARTIFACT_READY",
  "timestamp": "2026-04-01T09:05:00Z",
  "seq": 1,
  "eventVersion": 1,
  "payload": {
    "artifact": {
      "artifactId": "art_zip_7f3c2a",
      "hash": "sha256:1b2c3d4e5f60718293a4b5c6d7e8f901234567890abcdef1234567890abcdef",
      "size": 1048576,
      "mime": "application/zip",
      "type": "zip"
    },
    "kind": "zip"
  }
}

