{
  "eventId": "evt_test_build_started_001",
  "taskId": "task_test_123",
  "sessionId": "sess_test_abc",
  "assistant": "test",
  "type": "BUILD_STARTED",
  "timestamp": "2026-04-05T10:10:00Z",
  "seq": 50,
  "eventVersion": 1,
  "payload": {
    "buildId": "build_test_001",
    "tool": "build.run",
    "target": "web"
  }
}
