{
  "eventId": "evt_01HQ7FZK2B1KQ3S3GAP9V1Q2M8",
  "taskId": "task_123",
  "sessionId": "sess_abc",
  "assistant": "gpt",
  "type": "SPEC_PROPOSED",
  "timestamp": "2026-04-01T09:00:00Z",
  "seq": 10,
  "eventVersion": 1,
  "payload": {
    "target": "web",
    "templateId": "web-basic",
    "exportMode": "zip",
    "artifact": {
      "artifactId": "art_spec_001",
      "hash": "sha256:1b2c3d4e5f60718293a4b5c6d7e8f901234567890abcdef1234567890abcdef",
      "size": 2048,
      "mime": "application/json",
      "type": "spec"
    },
    "path": "spec.json",
    "summary": "Generate a web app: todo list with login, using template 'web-basic'.",
    "schemaVersion": "v1"
  }
}

